{
  "$schema": "https://json-schema.org/draft/2020-12/schema",
  "$id": "https://lumen.demo/schemas/plan.schema.json",
  "version": 4,
  "title": "Plan",
  "description": "One plan version, saved as plans/(event_id)/plan.v(N).json. POST /plan returns v1. POST /replan and POST /approve return the next version.",
  "type": "object",
  "additionalProperties": false,
  "required": [
    "event_id",
    "version",
    "created_at",
    "mode",
    "lead_hours",
    "timing_ms",
    "patients",
    "overflow",
    "audit",
    "summary"
  ],
  "properties": {
    "event_id": {
      "type": "string",
      "minLength": 1
    },
    "version": {
      "type": "integer",
      "minimum": 1
    },
    "created_at": {
      "$ref": "#/$defs/timestamp"
    },
    "mode": {
      "type": "string",
      "enum": [
        "early",
        "transfer",
        "critical"
      ],
      "description": "From lead time: 24 h or more early, 6 to 24 h transfer, under 6 h critical."
    },
    "lead_hours": {
      "type": "number",
      "description": "Window start minus the demo clock, in hours."
    },
    "timing_ms": {
      "type": "object",
      "description": "Milliseconds per step of the request that made this version. total is that request's wall time, at least the sum of the steps. Parse is timed in POST /alert, not here.",
      "required": [
        "total"
      ],
      "properties": {
        "parse": {
          "type": "integer",
          "minimum": 0
        },
        "affected": {
          "type": "integer",
          "minimum": 0
        },
        "rank": {
          "type": "integer",
          "minimum": 0
        },
        "match": {
          "type": "integer",
          "minimum": 0
        },
        "text": {
          "type": "integer",
          "minimum": 0
        },
        "total": {
          "type": "integer",
          "minimum": 0
        }
      },
      "additionalProperties": {
        "type": "integer",
        "minimum": 0
      }
    },
    "ai_sources": {
      "type": "object",
      "additionalProperties": false,
      "description": "Who did each AI step of the request that made this version: bedrock, or fallback (the rule-based path). Only the steps that ran have a key: text on POST /plan, replan and text on POST /replan, none on POST /approve. Rank uses rules only, so it has no key. Optional (schema v2): older saved plans do not have it.",
      "properties": {
        "replan": {
          "$ref": "#/$defs/ai_source"
        },
        "text": {
          "$ref": "#/$defs/ai_source"
        }
      }
    },
    "patients": {
      "type": "array",
      "items": {
        "$ref": "#/$defs/row"
      },
      "description": "Plan rows in rank order."
    },
    "overflow": {
      "type": "array",
      "uniqueItems": true,
      "items": {
        "$ref": "#/$defs/patient_id"
      },
      "description": "Patients with no chair. Each gets a staff call; the hospital is the last resort."
    },
    "audit": {
      "type": "array",
      "items": {
        "$ref": "#/$defs/audit_entry"
      }
    },
    "summary": {
      "type": "string",
      "description": "Two sentences written by Bedrock. Empty string until the text step runs."
    },
    "capacity_overrides": {
      "type": "array",
      "description": "The chair cuts that re-plans applied (set_clinic_capacity), one per clinic, date and shift. A later cut of the same slot replaces the earlier one. Every later version keeps them, later re-plans start from them, and POST /check counts chairs with them. Optional (schema v3): a plan with no cut does not have it.",
      "items": {
        "type": "object",
        "additionalProperties": false,
        "required": [
          "clinic_id",
          "date",
          "shift",
          "open_chairs"
        ],
        "properties": {
          "clinic_id": {
            "type": "string",
            "pattern": "^C\\d{2}$"
          },
          "date": {
            "type": "string",
            "pattern": "^\\d{4}-\\d{2}-\\d{2}$"
          },
          "shift": {
            "type": "integer",
            "enum": [
              1,
              2,
              3,
              4
            ]
          },
          "open_chairs": {
            "type": "integer",
            "minimum": 0
          }
        }
      }
    }
  },
  "$defs": {
    "ai_source": {
      "type": "string",
      "enum": [
        "bedrock",
        "fallback"
      ],
      "title": "AiSource"
    },
    "timestamp": {
      "type": "string",
      "pattern": "^\\d{4}-\\d{2}-\\d{2}T\\d{2}:\\d{2}:\\d{2}(\\.\\d+)?[+-]\\d{2}:\\d{2}$",
      "description": "ISO 8601 with an explicit offset, for example 2026-10-28T06:00:00-07:00.",
      "title": "Timestamp"
    },
    "patient_id": {
      "type": "string",
      "pattern": "^P\\d{3}$"
    },
    "language": {
      "type": "string",
      "enum": [
        "en",
        "es",
        "zh"
      ]
    },
    "reason": {
      "type": "string",
      "enum": [
        "session_in_window",
        "session_within_36h",
        "heart_failure",
        "missed_recently",
        "paratransit",
        "home_in_outage",
        "no_car",
        "lives_alone",
        "wheelchair",
        "limited_english"
      ],
      "description": "A rule key from rules.json urgency or difficulty. Each one is a reason chip."
    },
    "slot": {
      "type": "object",
      "additionalProperties": false,
      "required": [
        "date",
        "shift"
      ],
      "properties": {
        "date": {
          "type": "string",
          "pattern": "^\\d{4}-\\d{2}-\\d{2}$"
        },
        "shift": {
          "type": "integer",
          "enum": [
            1,
            2,
            3,
            4
          ],
          "description": "1 = 06:00, 2 = 10:30, 3 = 15:00, 4 = late 19:30."
        }
      },
      "title": "PlanSlot"
    },
    "texts": {
      "type": "object",
      "additionalProperties": false,
      "description": "Keyed by language code.",
      "properties": {
        "en": {
          "type": "string"
        },
        "es": {
          "type": "string"
        },
        "zh": {
          "type": "string"
        }
      },
      "title": "LangTexts"
    },
    "row": {
      "type": "object",
      "additionalProperties": false,
      "required": [
        "patient_id",
        "rank",
        "urgency",
        "difficulty",
        "reasons",
        "reason_text",
        "affected_session",
        "action",
        "clinic_id",
        "slot",
        "drive_minutes",
        "drive_source",
        "pickup_time",
        "ride",
        "book_today",
        "flags",
        "messages",
        "audio",
        "status",
        "pinned"
      ],
      "properties": {
        "patient_id": {
          "$ref": "#/$defs/patient_id"
        },
        "rank": {
          "type": "integer",
          "minimum": 1
        },
        "urgency": {
          "type": "integer",
          "minimum": 0
        },
        "difficulty": {
          "type": "integer",
          "minimum": 0
        },
        "reasons": {
          "type": "array",
          "uniqueItems": true,
          "items": {
            "$ref": "#/$defs/reason"
          }
        },
        "reason_text": {
          "type": [
            "string",
            "null"
          ],
          "description": "One sentence of 20 words or fewer, written by Bedrock. null until the text step runs."
        },
        "affected_session": {
          "anyOf": [
            {
              "$ref": "#/$defs/timestamp"
            },
            {
              "type": "null"
            }
          ],
          "description": "Start of the session that overlaps the window. null for notify_only."
        },
        "action": {
          "type": "string",
          "enum": [
            "early_session",
            "transfer",
            "hospital",
            "notify_only"
          ],
          "description": "early_session: an earlier chair at the home clinic. transfer: a chair at another open clinic. hospital: no chair fits; the patient is in overflow and gets a staff call. notify_only: the usual slot stays; the patient gets a heads-up (for example the home is in the outage area but no session overlaps the window)."
        },
        "clinic_id": {
          "type": [
            "string",
            "null"
          ],
          "pattern": "^(C|H)\\d{2}$",
          "description": "The new clinic. H01 for hospital rows. null for notify_only."
        },
        "slot": {
          "anyOf": [
            {
              "$ref": "#/$defs/slot"
            },
            {
              "type": "null"
            }
          ],
          "description": "The new chair. null for hospital and notify_only."
        },
        "drive_minutes": {
          "type": [
            "integer",
            "null"
          ],
          "minimum": 0,
          "description": "Home to the new clinic. null when there is no slot."
        },
        "drive_source": {
          "type": [
            "string",
            "null"
          ],
          "enum": [
            "location_service",
            "estimate",
            null
          ]
        },
        "pickup_time": {
          "anyOf": [
            {
              "$ref": "#/$defs/timestamp"
            },
            {
              "type": "null"
            }
          ],
          "description": "Slot start minus drive minutes minus pickup_buffer_minutes. null when there is no slot."
        },
        "ride": {
          "type": "string",
          "enum": [
            "self",
            "family",
            "paratransit",
            "medical_van",
            "wheelchair_van"
          ]
        },
        "book_today": {
          "type": "boolean",
          "description": "true for paratransit with a new slot: ADA paratransit is booked the day before."
        },
        "flags": {
          "type": "array",
          "uniqueItems": true,
          "items": {
            "type": "string",
            "enum": [
              "long_gap_after",
              "staff_call"
            ]
          },
          "description": "long_gap_after: the next usual session date minus the new slot date, in calendar days, is more than gap_limit_days. staff_call: a person must call this patient (hospital rows, declined rows, every row in critical mode)."
        },
        "messages": {
          "$ref": "#/$defs/texts",
          "description": "Patient message per language. Stored plan files keep the {name} placeholder. The router fills names only in HTTP responses. {} on hospital and notify_only rows and until the text step runs."
        },
        "audio": {
          "$ref": "#/$defs/texts",
          "description": "S3 key of the voice note per language, for example audio/PSPS-DEMO-01/P001.es.mp3."
        },
        "status": {
          "type": "string",
          "enum": [
            "draft",
            "approved",
            "confirmed",
            "declined",
            "no_answer"
          ]
        },
        "pinned": {
          "type": "boolean",
          "description": "Pinned and confirmed rows keep their slots on every re-run."
        },
        "packet": {
          "type": "object",
          "additionalProperties": false,
          "required": [
            "status",
            "sent_at",
            "channel",
            "to",
            "version"
          ],
          "description": "The transfer packet record. SIMULATED: nothing leaves Lumen. POST /packet sets it on transfer and hospital rows. Optional (schema v3): a row with no send does not have it.",
          "properties": {
            "status": {
              "type": "string",
              "enum": [
                "sent",
                "stale"
              ],
              "description": "sent: POST /packet recorded a simulated send. stale: a later re-plan changed the row's action, clinic_id or slot, so staff must tell the old facility."
            },
            "sent_at": {
              "$ref": "#/$defs/timestamp",
              "description": "Demo clock time of the send."
            },
            "channel": {
              "type": "string",
              "const": "simulated fax"
            },
            "to": {
              "type": "string",
              "description": "Receiving facility name and phone, for example \"DaVita Folsom Dialysis (279) 278-9702\"."
            },
            "version": {
              "type": "integer",
              "minimum": 1,
              "description": "The plan version the packet was built from."
            }
          }
        },
        "note": {
          "type": "object",
          "additionalProperties": false,
          "required": [
            "status",
            "sent_at",
            "send_at",
            "lang",
            "channel",
            "version"
          ],
          "description": "The voice note record. SIMULATED: nothing leaves Lumen and no audio is made. POST /notify sets it on early_session and transfer rows. One note per patient per change. Optional (schema v4): a row with no note does not have it.",
          "properties": {
            "status": {
              "type": "string",
              "enum": [
                "sent",
                "queued",
                "stale"
              ],
              "description": "sent: POST /notify recorded a simulated send. queued: the send waits until send_at (quiet hours 20:00 to 08:00 local). stale: a later re-plan changed the row's action, clinic_id or slot, so the row can get a new note."
            },
            "sent_at": {
              "anyOf": [
                {
                  "$ref": "#/$defs/timestamp"
                },
                {
                  "type": "null"
                }
              ],
              "description": "Demo clock time of the send. null while queued."
            },
            "send_at": {
              "anyOf": [
                {
                  "$ref": "#/$defs/timestamp"
                },
                {
                  "type": "null"
                }
              ],
              "description": "The next 08:00 local time when the note is queued. null when sent."
            },
            "lang": {
              "$ref": "#/$defs/language",
              "description": "The patient's language, or en when the row has no message in it."
            },
            "channel": {
              "type": "string",
              "const": "simulated voice note"
            },
            "version": {
              "type": "integer",
              "minimum": 1,
              "description": "The plan version the note was sent from."
            }
          }
        }
      },
      "title": "PlanRow"
    },
    "audit_entry": {
      "type": "object",
      "additionalProperties": false,
      "required": [
        "ts",
        "actor",
        "change"
      ],
      "properties": {
        "ts": {
          "$ref": "#/$defs/timestamp"
        },
        "actor": {
          "type": "string",
          "minLength": 1,
          "description": "Rosa, or lumen for automatic changes."
        },
        "change": {
          "type": "string",
          "minLength": 1
        }
      },
      "title": "AuditEntry"
    }
  }
}
